{
  "schemaVersion": 1,
  "id": "rel_01HZXA7Q2K4R",
  "siteId": "site_01HZX8K3Q9EF",
  "items": [
    {
      "kind": "set",
      "nodeId": "entry_01HZX8K3Q9WX",
      "nodeKind": "contentEntry",
      "target": {
        "rev": 7,
        "hash": "aaaaaaaaaaaaaaaaaaaaaaaaaaaaaaaaaaaaaaaaaaaaaaaaaaaaaaaaaaaaaaaa"
      },
      "base": {
        "rev": 5,
        "hash": "2222222222222222222222222222222222222222222222222222222222222222"
      }
    }
  ],
  "when": {
    "kind": "at",
    "at": "2026-11-02T06:00:00Z",
    "timeZone": "Europe/Istanbul",
    "localTime": "2026-11-02T09:00"
  },
  "state": "conflict",
  "hash": "rl1:1111111111111111111111111111111111111111111111111111111111111111",
  "approval": {
    "kind": "person",
    "by": {
      "id": "user_01HZX8K3Q9AY",
      "name": "Ayşe Demir"
    },
    "at": "2026-10-30T14:12:00Z",
    "executeAt": "2026-11-02T06:00:00Z"
  },
  "createdBy": {
    "kind": "human",
    "id": "user_01HZX8K3Q9AY",
    "name": "Ayşe Demir"
  },
  "createdAt": "2026-10-30T14:10:00Z",
  "updatedAt": "2026-10-30T14:12:00Z",
  "rev": 4,
  "outcome": {
    "kind": "conflict",
    "runId": "run_01HZXC9R3T5X",
    "at": "2026-11-02T06:00:12Z",
    "conflicts": [
      {
        "nodeId": "entry_01HZX8K3Q9WX",
        "expected": {
          "rev": 5,
          "hash": "2222222222222222222222222222222222222222222222222222222222222222"
        },
        "found": {
          "rev": 6,
          "hash": "3333333333333333333333333333333333333333333333333333333333333333"
        }
      }
    ]
  }
}
