{
  "schemaVersion": 1,
  "id": "rel_01HZXA7Q2K4U",
  "siteId": "site_01HZX8K3Q9EF",
  "items": [
    {
      "kind": "set",
      "nodeId": "entry_01HZX8K3Q9WX",
      "nodeKind": "contentEntry",
      "target": {
        "rev": 7,
        "hash": "aaaaaaaaaaaaaaaaaaaaaaaaaaaaaaaaaaaaaaaaaaaaaaaaaaaaaaaaaaaaaaaa"
      }
    }
  ],
  "when": {
    "kind": "at",
    "at": "2026-11-02T06:00:00Z",
    "timeZone": "Europe/Istanbul",
    "localTime": "2026-11-02T09:00"
  },
  "state": "expired",
  "hash": "rl1:1111111111111111111111111111111111111111111111111111111111111111",
  "createdBy": {
    "kind": "agent",
    "id": "agent_01HZX8K3Q9DK",
    "name": "Desk"
  },
  "createdAt": "2026-10-30T14:10:00Z",
  "updatedAt": "2026-10-30T14:12:00Z",
  "rev": 1,
  "outcome": {
    "kind": "expired",
    "at": "2026-11-02T06:00:05Z",
    "reason": "unapproved"
  }
}
